城市,关键字,职位名称,反馈率,公司名称,职位月薪,工作地点,公布时间,职位链接,岗位职责,技能要求,公司地址,保存时间,公司地点,公司性质,公司规模,工作经验,学历要求,职业薪水
北京,机器学习,广告算法高级工程师,,汽车之家,20001-30000,北京-海淀区,招聘中,http://jobs.zhaopin.com/199013411260090.htm,1.负责广告算法系统架构设计与开发，在用户行为分析和建模，网页内容挖掘，广告匹配排序等方面进行深入研究； 2.优化在线广告投放效果，满足客户需求和改善用户体验，提高流量变现能力，达到技术和商业的完美结合； , 1.本科及以上学历，计算机或者数学相关专业毕业，3年以上互联网算法从业经历；2.具备Linux环境开发经验，掌握至少一种主流编程语言（C++/Java/Python等）； 3.具备机器学习、自然语言处理、数据挖掘、推荐系统、在线广告等至少一种研究背景或项目背景；4.熟练掌握海量数据处理技术，有使用Hadoop/Hive/Spark分析海量数据的能力和经验；5.优秀的分析和解决问题的能力，对挑战性问题充满激情，有较强的沟通能力，责任心和团队意识佳；,北京市海淀区北四环丹棱街3号中国电子大厦B座10层,2018-03-18,北京-海淀区,民营,1000-9999人,5-10年,本科,20001-30000元/月
北京,机器学习,风控NLP算法工程师（复制）,,汽车之家,30000-50000,北京,招聘中,http://jobs.zhaopin.com/199013411259135.htm,本职位归属于汽车之家风控团队，主要面向自然语言处理、文本语义挖掘领域的专业资深人士进行招聘。具体工作职责1负责自然语言处理相关的底层技术搭建，同时建立对应的语料库2负责针对搜索、推荐、论坛等不同场景下，文本的语义挖掘、情感趋向；3利用大数据环境，建立属于自己业务特征的语料库，并可以将NLP技术应用于解决实际问题。,1.计算机、数学、统计学或相关专业，硕士及以上学历；对概率统计和机器学习基本原理有扎实理解；2.掌握常用的文本挖掘相关的算法，如NGram、HMM、RBF、Text4Rank、Word2Vec等算法。3.熟悉Linux平台，熟练掌握一门脚本语言，如Python；4熟悉Hadoop/hive环境，熟悉spark/tensorflow等计算框架的使用，精通Java/C++以及常用脚本语言者优先； 5在如下领域有丰富的经验或进行过专门的研究 分词、词性标注、新词发现、词义消歧、情感分析、主题模型、话题分析、命名实体识别、事件发现、舆情分析、知识图谱，独立实现过复杂NLP系统；63年以上自然语言处理和机器学习经验，且在大数据的真实场景中有过实践者经验尤佳； 7良好的敬业精神，开放包容的学习心态，热爱算法，和良好的团队合作精神。,北京市海淀区北四环丹棱街3号中国电子大厦B座10层,2018-03-18,北京,民营,1000-9999人,3-5年,不限,30000-50000元/月
北京,机器学习,NLP算法高级工程师,,汽车之家,20001-30000,北京-海淀区,招聘中,http://jobs.zhaopin.com/199013411260088.htm,1.负责基础自然语言处理技术，包括文本分类、句法分析、自动摘要、情感分析和语义理解等。2.负责广告等商业产品NLP技术研发3.负责海量语音数据分析和挖掘，以及语音识别相关领域研发。4.负责智能对话系统和知识图谱等研发，以及新技术和方向的研究 ,1.计算机或相关专业，扎实的C/C++/Java/Python开发功底，2.三年以上NLP领域相关经验。熟练掌握NLP领域的主要方法，熟悉主要机器学习算法。 3.熟练掌握Hadoop、Spark等分布式平台。熟练掌握至少一种深度学习框架(Tensorflow，MXNet，Pytorch等)4.有语音识别，对话系统等实际产品开发经验者优先。5.良好的沟通能力和组织协调能力，有一定创新意识。,北京市海淀区北四环丹棱街3号中国电子大厦B座10层,2018-03-18,北京-海淀区,民营,1000-9999人,5-10年,本科,20001-30000元/月
北京,机器学习,算法专家（复制）,,汽车之家,49999元以上,北京,招聘中,http://jobs.zhaopin.com/199013411259131.htm,1.负责数据云平台算法架构应用工作，利用机器学习/深度学习等技术挖掘海量数据，构建业务级的用户画像体系2.和业务团队深入合作，解决在业务发展中遇到的算法模型和数据服务问题，具备一定的前瞻性，影响和指导业务发展,1.本科以上学历，计算机/数学相关专业，4年以上数据算法相关工作经验2.熟悉大规模数据挖掘、机器学习、自然语言处理等领域技术，深入理解常用的机器学习算法及平台并熟练应用3.主导开发过用户画像建模、用户画像系统或DMP系统的开发工作，对基于海量数据分析挖掘用户特征有丰富经验4.熟练使用一种以上工程开发语言（C/C++/Java/Go/Python等），掌握基于hadoop等大数据平台工具的开发与设计，熟悉Hive，map/reduce开发5.具有良好的沟通能力和团队协作精神，对数据敏感和敏锐的业务直觉，学习能力强,电子大厦,2018-03-18,北京,民营,1000-9999人,5-10年,不限,49999元/月以上
北京,机器学习,算法工程师（经销商）,,汽车之家,30000-50000,北京,招聘中,http://jobs.zhaopin.com/199013411259488.htm,1. 分析海量数据，对用户基础数据、行为数据进行算法建模，生成用户标签并落地应用2. 利用机器学习、深度学习技术构建用户标签库并落地应用-,1. 本科以上学历，计算机/数学相关专业，2年以上数据算法相关工作经验2. 熟悉大规模数据挖掘、机器学习、自然语言处理等领域技术，熟练掌握常见的分析挖掘算法如决策树，SVM，聚类算法等3. 参与过用户画像建模、用户画像系统或DMP系统的开发工作，对基于海量数据分析挖掘用户特征有丰富经验4. 熟练使用一种以上工程开发语言（C/C++/Java/Go/Python等），掌握基于hadoop等大数据平台工具的开发与设计，熟悉Hive，map/reduce开发,北京市海淀区理想国际大厦,2018-03-18,北京,民营,1000-9999人,3-5年,本科,30000-50000元/月
北京,机器学习,图像识别算法工程师,,北京华正明天信息技术股份有限公司,20001-30000,北京,招聘中,http://jobs.zhaopin.com/CC302682517J00027282615.htm,1.负责视频识别的算法研究和工程实现；2.负责跟进行业前沿技术发展趋势，跟踪国际最新算法发展方向和相应技术；3.熟悉常用的机器学习算法。,1.工作经验 -有相关工作经历或实验室研究背景； -C++熟练，5年以上开发经验，有Windows/Linux跨平台开发经验。2.能力要求 -熟悉视频分析算法、图像分析算法；在图像或视频分析方面有三年以上工作经验； -能够对能够对视频跟踪（VT）和识别（VR）算法进行工程实现和优化； -有LR/Adaboost/GMM/SVM/CRF/MaxEnt/HMM/DNN/CNN/RNN的研究背景，熟悉OpenCV； -能够流畅阅读英文文献。3.优先考虑 -能够Caffe/TensorFlow/Torch/Theano/Keras/Mxnet/Currennt上开展实验上开展实验者优先； -熟悉python且有3年以上python实战经验； -有大数据平台实际搭建和使用经验。,北京市海淀区中关村大街36号,2018-03-18,北京,民营,100-499人,5-10年,本科,20001-30000元/月
北京,机器学习,大数据开发工程师,,国美在线电子商务有限公司,20001-30000,北京,招聘中,http://jobs.zhaopin.com/377931819255733.htm, 1、负责数据加工、清理、处理程序的开发 2、负责数据相关平台的搭建、开发、维护、优化 , 1、计算机相关专业，本科及以上学历，5年左右Java开发工作经验，学习能力突出；2、熟悉hadoop生态系统内常见项目的使用（hdfs、hive、hbase、spark、zookeeper等），有实际大数据项目经验优先3、熟练使用storm，sparkstreaming，flink其中一种实时计算框架4、熟练掌握Oracle、MySql等主流数据库5、精通JAVA，熟悉Web开发流程，有丰富开发经验； 6、熟悉Linux/Unix系统环境下的操作；熟悉Tomcat等应用服务器7、具有良好的沟通能力、组织能力及团队协作精神，有较强的分析和解决问题的能力； 加分项 1、有海量大数据开发经验 2、有Hadoop、Spark、HBase深入源代码分析经验 3、熟悉机器学习、数据挖掘、分布式计算 4、基础能力+学习能力特别优秀者 ,北京市朝阳区霄云路26号鹏润大厦B座17层,2018-03-18,北京,上市公司,1000-9999人,3-5年,本科,20001-30000元/月
北京,机器学习,高级业务规划经理-人工智能方向,,北京航天云路有限公司,10000-15000,北京,最近,http://jobs.zhaopin.com/CC422277937J00024280715.htm,1.承担人工智能类业务规划及重点科技专项项目；2.研究企业外部市场态势，定期形成研究报告，参与编制公司战略规划发展方案、商业计划方案、落地方案等；3.对公司资源进行商业化业务分析及规划，对运营体系进行监控、分析，并在此基础上推进商业化规划； 4.进行AI方向创新型产品线需求、策略及运营规划，推动建立创新产品线； 5.辅助支持各部门制订AI战略规划和业务计划。 ,1.硕士及以上学历，计算机相关专业；2.具备知识图谱、机器学习、数学建模或模型应用的相关专业背景或工作经验优先 ；3.熟练或资深的数据统计、建模工具使用者优先（R/SAS等），具备企业级产品设计经验者优先；4.极强的问题分析能力、数据理解能力、逻辑思考能力，较强的沟通能力、有团队合作精神； 5.良好的个人发展意愿，较强的学习能力。,北京市海淀区西四环中路16号院7号楼15层,2018-03-18,北京,国企,20-99人,1-3年,硕士,10000-15000元/月
北京,机器学习,高级数据产品经理,,北京智慧星光信息技术有限公司,20001-30000,北京-海淀区,招聘中,http://jobs.zhaopin.com/467352913251167.htm, 1.根据公司战略，分析市场对大数据需求，制定数据产品运营策略，参与数据产品Roadmap的制定，支持业务团队或第三方调取和使用数据的需求；2.关注大数据应用方向的研究，把握行业发展趋势，分析跟踪竞争对手，定期完成分析报告或产品竞争战略和计划；3.负责数据产品的需求分析，需求管理，产品设计和产品迭代；挖掘数据的商业价值，丰富产品形态，输出高质量PRD文档；组织需求管理和评审；4.负责跨部门协调沟通工作，与UI、UE和研发人员一起合作，确保产品研发进度，直至成功发布；5.结合业务反馈以及市场需求，提出产品改进意见，不断完善在线产品、持续提升产品的功能和数据处理能力，支持各类用户对大数据的复杂需求；,1.本科及以上学历要求，三年及以上数据分析/产品设计相关经验，能够独产承担产品规划工作。2.具备良好的数据敏感度和商业敏感性，能够敏锐的捕获数据价值和产品机会。3.对产品有很好的组织规划能力，具有较强的文档撰写能力与经验，精通各种产品原型设计工具。4.优秀的表达、沟通与协调能力；良好的团队合作精神、保密意识。5.了解底层数据的架构以及应用层数据分析和算法，对大数据分析和数据挖掘有一定认知，具有产品创新精神。6.具备数据分析、数据挖掘、数据可视化、数据建模、机器学习等背景或工作经验，有人工智能/数据类/云服务（PaasSaas）/企业级平台类产品工作经验者优先。,北京市海淀区中关村大街27号中关村大厦12层,2018-03-18,北京-海淀区,民营,500-999人,5-10年,本科,20001-30000元/月
北京,机器学习,C++软件开发工程师,,三角兽(北京)科技有限公司,20000-35000,北京-朝阳区,招聘中,http://jobs.zhaopin.com/371571486250012.htm,1、负责C++软件开发； 2、和其他工程师一起合作完成任务；3、负责解决开发中遇到的各种技术问题；4、参与下一代语音对话系统、智能问答系统、个性化推荐交互的研发，探索非结构化文本理解、知识抽取、对话决策管理等前沿技术问题的实用化解决方案；5、结合实际业务场景，应用NLP、AI、ML技术解决实际问题。, 1、2年以上软件开发工作经验； 2、熟悉面向对象的设计及开发思想，了解常用的设计模式，掌握一种面向对象编程语言如C++、Java、C#等等；3、能独立工作，且具备快速学习的能力。 4、工作认真细致踏实肯干，具有较好的团队协作精神和沟通能力，能够承受紧急任务安排下的工作压力并可以按时完成工作且保证质量。5、有自然语言处理和机器学习相关项目经验优先。,北京市朝阳区惠新东街甲2号住总地产大厦8层,2018-03-18,北京-朝阳区,民营,20-99人,,本科,20000-35000元/月
北京,机器学习,大数据研发工程师,,北京登云美业网络科技有限公司,10001-15000,北京-大兴区,招聘中,http://jobs.zhaopin.com/345960835250053.htm,1、参与公司的数据平台的开发建设；2、设计和研发数据分析相关的工具平台；3、研究和设计公司的大数据仓库平台，负责数据仓库中的数据计算ETLpipeline的设计和开发，管理和维护。4、利用数据挖掘、机器学习相关算法，解决业务需求5、对海量的业务数据、设备据进行挖掘分析，发现数据和业务背后的规律，完成对设备状态分析的建模；,1.三年以上大数据研发经验；2.熟悉linux下开发！精通java，具有良好的编程习惯和算法基础；3.熟悉大数据开发相关技术，如hadoop、hive、spark、impala、storm、hbase等；4.能深入了解hadoop集群及其周边常用模块(YARN/Zookeeper/Flume/Kafka/RabbitMQ)；5.熟练数据仓库，对多维数据建模有深入理解，玩过kylin的优先考虑；6.有OLAP引擎相关开发经验优先；7.有BI开发经验，有网站数据、用户数据、电商、点击流、精准营销等相关经验；8.熟悉常用数据挖掘与机器学习算法优先；9.思维敏捷，有较强的钻研学习能力，较好的沟通能力、团队合作。,北京市亦庄经济技术开发区荣华路南路2号院大族广场T5-26层,2018-03-18,北京-大兴区,民营,100-499人,3-5年,本科,10001-15000元/月
北京,机器学习,大数据开发工程师,,北京中北信科技发展有限公司,10001-15000,北京,最近,http://jobs.zhaopin.com/120163763250477.htm,1)负责大数据平台相关产品的研发工作；2）负责大数据相关项目的开发实施；3）负责外省大数据相关项目的部署、开发和维护工作。 ,1.计算机或相关专业本科(或以上)学历2.要求熟练掌握J2SE编程技能3.熟悉Linux环境下编程、调试和测试技巧4.对Hadoop/HBase/Hive有熟练的操作经验（以上条件为必选，下面要求为可选）5.有网络编程、分布式计算等学科背景或编程经验者优先6.熟悉SQL编程，有一定数据仓库使用经验者优先7.了解数据挖掘/机器学习算法者优先8.对Hadoop体系中某一个开源框架的源代码有深入研究者优先。,北京市新街口冠华大厦,2018-03-18,北京,合资,20-99人,1-3年,大专,10001-15000元/月
北京,机器学习,大数据分析师,,用友广信网络科技有限公司,25000-35000,北京-海淀区,招聘中,http://jobs.zhaopin.com/280703830250143.htm,1.负责搭建公司大数据整体架构，包括数据采集、预处理、数据存储、数据融合、数据挖掘以及数据可视化；2.根据企业整体应用架构和思路，建设数据运维团队（数据采集、数据处理、数据分析、数据运营团队、主数据团队）；3.跟随业界大数据技术发展动态，匹配公司业务需要，参与企业级大数据产品和应用规划设计，提前识别关键技术并实现技术储备；4.负责智慧城市中数据层的项目建议书编写、技术方案编写，负责大数据的需求调研、客户技术交流等工作，挖掘引导客户需求，针对需求制定技术规划与设计方案。,1.计算机、统计学、信息工程、通信工程、软件工程、项目管理、人工智能等相关专业本科及以上学历，5年以上信息化工作经验，3年以上大数据分析经验，有大数据、人工智能相关工作经验者优先；2.思路敏捷清晰，有敏锐的市场洞察力，有很强的逻辑思维能力和推理能力，有良好的产品意识，保持对大数据产品的好奇心，具备一定的产品设计能力；3.熟悉主流的云计算、大数据产品（hadoop、spark、storm，flink，beam等），熟悉算法设计/数据结构、数学模型、模型优化、机器学习等；4.具备较强的沟通协调能力、团队组织能力、分析判断能力、较强的学习能力和处理问题能力，工作细致严谨、责任心强；5.具备良好的品德和职业素养，工作高效，服从管理，执行力强，适应企业文化，能够吃苦耐劳，以身作则。,北京市海淀区北清路68号用友软件园北区16号楼D座三层,2018-03-18,北京-海淀区,上市公司,100-499人,3-5年,本科,25000-35000元/月
北京,机器学习,数据挖掘算法专家,,北京捷通华声科技股份有限公司,30000-60000,北京,最新,http://jobs.zhaopin.com/120359452259341.htm,1.负责根据灵云人工智能各核心能力算法的数据处理需求，提供数据处理的高级技术支持与支撑工作；2.负责各种数据资源处理的具体方法制定与制作流程的规范化，为灵云人工智能各项核心技术构建一套有序高效与高质量的数据处理体系与方案，包括但不限于文本、语音与图像数据加工的指导、知识库编辑的培训和技术文档的编写等内容；3.负责数据的分析、挖掘、优化和难点攻坚等数据处理层面工作，并将其成果应用相关产品线中，以及配合核心研究员完成各种数据问题的分析、解决及其数据资源的产品化；4.负责灵云人工智能中数据平台的方案设计、搭建、维护和优化等工作。,1.学历要求 -统招统分本科及以上学历，数学、统计学、计算机、智能信息处理类等专业背景。2.工作经验及能力要求 -3年以上工作经验，2年以上团队管理经验； -对数字，数据敏感，具备良好的逻辑思维能力，能够从海量数据中发现有价值的规律； -优秀的分析问题与解决问题能力，具有较好的归纳能力、文字和语言表达能力； -熟悉数据结构，熟悉数据挖掘和机器学习算法等常用算法，并对机器学习算法和理论有较深入的研究（例如对决策树、聚类、逻辑回归，序列标注，关联分析、SVM，贝叶斯等数据挖掘算法有较深理解和实践经验）； -熟悉java/Python，有算法研究背景经验； -熟悉文本挖掘分析方法及分布式数据分析工具使用； -熟悉Hadoop、Spark平台，熟悉storm流式处理框架，熟悉Hive工具，或百T左右数据量处理经验。3.优先考虑 -有社会性网络数据的挖掘经验者优先。-有相关从业的工作背景经验者优先考虑。 ,北京市海淀区中关村软件园2号楼A座2101,2018-03-18,北京,民营,100-499人,5-10年,硕士,30000-60000元/月
北京,机器学习,高级图像算法工程师（人工智能研究院）,,上海迈外迪网络科技有限公司北京分公司,35000-70000,北京-海淀区,最近,http://jobs.zhaopin.com/174731726250612.htm,使用最新的深度学习技术处理海量的图片数据，进行图像中特定物体的检测，视频中的特定物体跟踪，图像语义理解等算法研究工作，并负责算法在应用场景的落地。, 1、有图像处理、图像识别、或图像理解相关项目经验；2、熟练掌握一门常用数据处理脚本语言，如python或者perl ，熟悉基于该语言的常用开源算法；3、对图像处理、或图像识别、或计算机视觉的某一研究领域有较深的研究；4、使用过基于卷积神经网络的图像识别、目标检测方法。有以下经验者优先考虑 1、精通C/C++，能够编写高质量代码；2、机器学习相关项目经验；3、有hadoop，spark等相关经验；4、对Caffe或TensorFlow或Darknet的源码有较深入的了解；5、熟练的英语阅读能力，能够阅读英文论文，具有良好的自学能力，能快速了解最新的学术进展。,北京市海淀区中关村大街1号海龙大厦,2018-03-18,北京-海淀区,民营,100-499人,3-5年,本科,35000-70000元/月
北京,机器学习,数据分析师,,新洲康之源(北京)商贸有限公司,10001-15000,北京,招聘中,http://jobs.zhaopin.com/710870622250357.htm,1、负责品牌用户、流量方向的专项分析报告；2、结合具体业务场景，通过数据分析手段进行营销与销售问题的诊断，包括对各项推广活动的效果分析、运营举措的效果分析、品牌销售分析、用户画像分析等等；3、对日常工作（行销、会员管理等）进行数据分析；4、负责编写、校订根据模型产生的结果。并可以及时对产品问题进行反馈与跟踪。,1.3年以上数据分析工作经验，或在统计/数学/计算机/心理学/物理学/生物学/经济学等相关计量分析领域拥有本科以上学位。2.在分析、预测、优化方向有实际应用经历。对数据敏感，喜欢并善于从数据中发现规律；3.精通excel，具备优秀的数据统计及图表展现能力，良好分析能力，能独立撰写、汇报分析报告；4.了解数理统计分析方法，例如假设检验、方差分析、回归分析、聚类分析等，能使用SPSS进行数据分析的优先；6.了解机器学习中的预测模型，如logisticregression、神经网络、SVM及决策树等的优先；7.工作认真负责，勇于承担责任，有良好的沟通能力，注重团队合作精神。 ,北京市朝阳区光华路4号院1号楼28层,2018-03-18,北京,民营,500-999人,1-3年,本科,10001-15000元/月
北京,机器学习,高级数据挖掘算法工程师（人工智能研究院）,,上海迈外迪网络科技有限公司北京分公司,35000-70000,北京-海淀区,最近,http://jobs.zhaopin.com/174731726250611.htm,1、负责机器学习算法的设计和开发，从商户运营数据中发掘价值、规律、和模式；2、负责分析和理解云端收集的海量商户运营数据，以数据驱动商户的运营管理能力的提升；3、负责整理日志数据得到实验所需的训练和评测数据，并训练算法模型和评估质量；4、负责机器学习算法在产品系统中的实现和应用，推送算法在具体场景的落地。 ,1、具备机器学习、或统计学习、或深度学习方向的理论背景；2、熟练掌握一门常用数据处理脚本语言，如python或者perl，熟悉基于该语言的常用开源算法；3、具备扎实的数学功底和逻辑分析能力，具备数据分析和归纳能力，具备敏锐的数据洞察能力；4、熟练使用支持LR、GBDT、或DNN等常用模型的开源工具，对机器学习开源工具的发展有持续的兴趣和跟进；5、熟练的英语阅读能力，能够阅读英文论文，具有良好的自学能力，能快速了解最新的学术进展。,北京市海淀区中关村大街1号海龙大厦,2018-03-18,北京-海淀区,民营,100-499人,3-5年,硕士,35000-70000元/月
北京,机器学习,算法优化工程师（指静脉算法开发）,,北京智慧眼科技股份有限公司湖南分公司,25000-50000,北京,最近,http://jobs.zhaopin.com/489650620250640.htm,,,北京市中关村软件园君正大厦4层,2018-03-18,北京,上市公司,100-499人,,不限,25000-50000元/月
北京,机器学习,射频算法工程师-北京,,大唐移动通信设备有限公司,10000-15000,北京,最近,http://jobs.zhaopin.com/132705134250971.htm,,1、通信、电信等相关专业，本科及以上学历；2、有良好的数学功底，熟悉信号处理理论、机器学习、数学建模等相关知识；3、掌握回归算法、矩阵运算、线性规划等经典算法思想；4、熟悉数字信号处理、数字基带信号处理和频域时域变换、非线性建模与非线性处理方法等，熟悉移动通信系统架构，物理层基础知识；5、理解射频、微波基本原理，具有中射频、微波等硬件基础或经验者优先。,北京市海淀区学院路29号,2018-03-18,北京,国企,1000-9999人,,本科,10000-15000元/月
