城市,关键字,职位名称,反馈率,公司名称,职位月薪,工作地点,公布时间,职位链接,岗位职责,技能要求,公司地址,保存时间,公司地点,公司性质,公司规模,工作经验,学历要求,职业薪水
北京,机器学习,WXG08-122 微信搜索机器学习算法工程师,,深圳腾讯计算机系统有限公司,面议,北京,最新,http://jobs.zhaopin.com/120072290295713.htm,负责微信搜索排名算法优化；负责LTR、ClickModel等相关算法研发；负责模型特征工程的优化和实验。,计算机相关专业硕士及以上学历，两年以上的互联网工作经验；熟练掌握C/C++，Java，python等编程语言，熟练使用linux环境；熟悉常用的自然语言处理、机器学习、数据挖掘算法，并有相关项目经验；有搜索、推荐或广告业务的排序质量算法工作经验；有分布式机器学习平台构建经验；对深度学习、强化学习、迁移学习有深刻的理解和实战应用。,,2018-03-18,北京,民营,10000人以上,无经验,,
北京,机器学习,机器学习工程师/研究员,,北京商高科技有限公司,20000-25000,北京,最新,http://jobs.zhaopin.com/482088230250004.htm,使用最新机器学习、深度学习技术实现前沿的人工智能系统，设计和训练深度神经网络实现图像、语音、文字等信息的处理、识别；,基本专业能力（按优先次序）有钻研精神，对新技术有浓厚的学习兴趣，能够快速适应新技术；熟练的编程技巧，熟练掌握多种程序语言较强的文档，文献检索和阅读能力；机器学习相关专业或自学机器学习技术，对深度学习等新技术有强烈兴趣；有图像处理、机器视觉和数据挖掘等学习或工作经历[加分项目]本科以上学历，IT相关专业；较好的英语文档阅读能力，良好的文档编写习惯；有过软件产品研发开发经历；熟悉Linux系统操作；掌握Python、C++、Java、Lua等脚本语言；有计算机并行、显卡加速程序开发经历；尝试使用过Caffe，、Theano、Spark等；参与过开源软件开发；提供活跃的Github、oschina或相关技术论坛账号ID;证明你的相关能力的其他内容；＊请在简历或邮件上注明并解释自己与加分项相符的经历或能力。,北京市丰台区南四环西路186号,2018-03-18,北京,民营,20-99人,,本科,20000-25000元/月
北京,机器学习,MIG16-地图检索机器学习算法高级研发工程师（北京）,,深圳腾讯计算机系统有限公司,面议,北京,最新,http://jobs.zhaopin.com/120072290295087.htm,负责腾讯地图搜索策略算法的研发工作，持续迭代提升转化效果和用户体验地图场景下用户查询理解，机器学习排序，实时排序模型，深度学习模型参与搜索引擎各个底层模块的架构设计、开发工作,计算机相关专业本科以上学历，2年以上工作经验；熟悉Linux系统，精通Linux/Unix平台上的C/C编程，gcc/g/gdb开发环境熟悉常用的排序模型和推荐算法;有搜索算法，数据挖掘、个性化推荐相关领域开发经验优先优先;优秀的逻辑思维能力，良好的团队合作精神，较强的沟通能力和学习能力,,2018-03-18,北京,民营,10000人以上,无经验,,
北京,机器学习,图像识别和机器学习工程师,,速得尔科技(北京)有限公司,12000-24000,北京-昌平区,最新,http://jobs.zhaopin.com/310597188250025.htm,1、负责图像处理、目标检测和识别算法的设计和实现； ,1.硕士及以上学历，熟悉图像处理及机器视觉的基础理论和算法知识。2.有基于深度学习和神经网络构建图像识别的经验。3.具有较强的编程实现能力，精通c/c++或python编程。4.有OpenCV等经验者优先。,Room301JiyanlongTower，XISANQI，Changping,2018-03-18,北京-昌平区,民营,20-99人,3-5年,不限,12000-24000元/月
北京,机器学习,资深机器学习工程师 (020733),,京东金融,面议,北京,招聘中,http://jobs.zhaopin.com/192921312300074.htm,1，授信/反欺诈—建立和优化风控、反欺诈、账户安全体系，设计并实现反欺诈、账户安全场景下的风险评价模型；2，智能服务—围绕京东金融业务提供基于如人脸识别、语义分析、声纹识别、虹膜识别等成熟或创新的应用实践；3，精准营销—将创新算法应用于行为轨迹挖掘以及用户精准营销等应用场景，优化现有模型的预测能力。(多工作方向，视候选人具体情况而定),1、硕士以上学历，计算机、数学和统计学背景；2、扎实的理论和算法基础，能够在Spark环境下快速高效的实现常用机器学习模型和算法；3、良好的学习意愿和学习能力，能够快速掌握工作所需技能，对海量数据在金融场景下的应用感兴趣。,北京经济开发区科创11街18号院京东大厦,2018-03-18,北京,外商独资,1000-9999人,5-10年,硕士,
北京,机器学习,高级机器学习平台研发工程师-系统优化方向,,京东商城,面议,北京,招聘中,http://jobs.zhaopin.com/192921312309588.htm,负责大规模机器学习平台研发工作。跨越系统与算法的边界，设计更优雅高效的分布式机器学习算法，来驱动数万核数千卡集群上的深度学习算法，通过更有效地挖掘算力，来驱动更好的建模技术。1、需要针对BLAS及高层的Eigen做开发和性能调优相关工作2、需要具备GCC、HHVM相关编译优化经验 ,1、扎实的LinuxC/C++/Shell编程功底。2、熟练使用Python语言。3、熟悉操作系统原理、熟悉x86计算机体系结构，能够做内存及CPU调度层面的优化工作。4、具备数值算法技能，了解常见的异构计算优化技巧（GPU）。加分项1、熟练使用Tensorflow/mxnet等机器学习框架。2、从事过高性能计算领域性能优化者优先，ISC竞赛者优先。3、从事过CUDAKernel开发者优先。4、Github项目优秀者、有优秀技术博客者优先。,北京市朝阳区北辰西路8号北辰世纪中心A座6层,2018-03-18,北京,外商独资,1000-9999人,,本科,
北京,机器学习,高级Python研发工程师（机器学习业务方向）,,京东商城,面议,北京,招聘中,http://jobs.zhaopin.com/192921312309590.htm,负责京东广告大规模机器学习平台业务平台的后台研发工作。 ,1、扎实的Linux环境下Python/Shell编程功底2、有PythonWeb框架（tornado/django/flask）、APIServer开发经验3、Python性能调优经验（多线程、异步）4、熟悉TCP/IP，HTTP等网络协议，熟悉RESTfulAPI设计5、熟悉MySQL、HBase、Redis等常用数据库的使用、开发与调优加分项1、有2年及以上Python架构经验优先2、了解常见的机器学习框架，如Tensorflow/mxnet等。3、开源贡献者优先，对开源机器学习框架贡献者优先4、Github项目优秀项目者优先，技术博客者优先。5、熟悉Golang编程优先6、熟悉docker/K8s优先,北京市朝阳区北辰西路8号北辰世纪中心A座6层,2018-03-18,北京,外商独资,1000-9999人,,本科,
北京,机器学习,机器学习工程师（算法）,,北京恒昌利通投资管理有限公司,面议,北京-朝阳区,最近,http://jobs.zhaopin.com/392160220261299.htm,1、负责大规模结构化、非结构化的数据的处理、数据分析工作；2、负责公司信用模型、欺诈模型的建模工作；3、负责金融领域知识图谱的建立，组团欺诈，中介识别的挖掘工作；4、应用最新的数据挖掘、机器学习技术持续提升模型的各项技术指标；5、负责规则引擎的研发工作。,1、计算机相关专业本科及以上学历；2、数据挖掘，机器学习或自然语言处理相关专业；3、编程基础扎实，精通java或c++等编程语言，熟练掌握python、shell等脚本语言，熟悉常见的算法和数据结构；4、熟悉linux操作系统开发，熟悉数据分析；5、熟悉常见机器学习算法原理，熟练掌握并应用聚类、分类、回归、排序等模型解决实际业务问题；6、有良好的团队合作意识和沟通能力。,北京市朝阳区光华路7号汉威大厦东区5层A1,2018-03-18,北京-朝阳区,民营,10000人以上,3-5年,硕士,
北京,机器学习,数据分析师（机器学习）,,海尔集团公司,面议,北京-海淀区,招聘中,http://jobs.zhaopin.com/121066847317237.htm,1、负责个性化推荐系统开发，实现相关大规模数据挖掘/机器学习算法2、参与设计和改进推荐引擎架构，提升在线推荐系统性能，稳定性，扩展性3、参与推荐策略设计，为推荐策略迭代提供高效和灵活的架构支撑。4、跟踪互联网领域相关推荐和机器学习算法发展趋势，对前沿技术结合业务进行实验和落地。,1、有3年及以上的推荐系统、个性化搜索、广告引擎等相关领域较强的算法工作经验。2、有Java，C++或Python等面向对象设计开发经验，具备较强的编码能力和扎实的数据结构和算法功底3、掌握运用Hadoop，Spark或MPI等开源平台和工具对大规模数据进行处理和计算4、熟悉常用的机器学习和数据挖掘算法，如分类，聚类，回归，协同过滤，内容过滤等，有大规模机器学习优化项目经验优先，有相关深度学习模型应用经验优先。5、有大规模海量数据机器学习/数据挖掘/计算广告/搜索引擎相关经验优先6、具备良好的沟通和表达能力，有较好的产品意识,北京市海淀区知春路106号北京中关村皇冠假日写字楼6层,2018-03-18,北京-海淀区,国企,10000人以上,,不限,
北京,机器学习,数据挖掘/机器学习实习生,,北京奇虎科技有限公司,面议,北京,招聘中,http://jobs.zhaopin.com/467717611259513.htm,参与挖掘站点/网页特征，用机器学习/深度学习技术优化资源分配、数据抓取、rank基础特征抽取等,1、熟悉linux系统下的程序开发，掌握python/php/shell中至少1门语言；2、了解hadoop/spark分布式计算环境3、有机器学习、数据挖掘、推荐算法等相关领域经验者优先4、实习期3月以上,公司名称北京奇虎科技有限公司公司主页http//www.360.cn,2018-03-18,北京,上市公司,1000-9999人,1年以下,本科,
北京,机器学习,机器学习工程师,100%,北京嘉和美康信息技术有限公司,20001-30000,北京,招聘中,http://jobs.zhaopin.com/146296596251332.htm,,,北京市东城区青龙胡同1号歌华大厦1段B座619室,2018-03-18,北京,民营,500-999人,,硕士,20001-30000元/月
北京,机器学习,机器学习高级工程师,100%,包头市包银消费金融股份有限公司,20001-30000,北京,招聘中,http://jobs.zhaopin.com/CZ461946130J00021492612.htm,1、开展机器学习在消费金融领域开发工作；2、负责搭建机器学习框架，解决金融消费方向相关的风控决策优化；3、配合风控部门模型开发和优化工作，建立基于大规模、多来源数据的用户反欺诈模型、征信模型和授信模型；4、应用完备的统计学/组合数学/数值分析/信息论知识对海量异构数据进行融合挖掘，在完成良好的特征工程前提下对数据进行多场景的分类/回归应用；5、跟踪前沿的算法理论，并且将优秀的算法应用到业务场景中，通过技术创新提升业务价值。,1、理工类硕士以上学历，数学、物理、人工智能、模式识别等专业方向优先；2、熟悉掌握常用的数据挖掘/机器学习算法理论(图论/LR/GBDT/RF/FM/PCA/SVD)，对深度学习算法(BP/CNN/RNN/PreTrain/GAN)有所实践，具备真实环境大数据集下的数据挖掘/机器学习实战经验；3、深刻理解深度学习、统计机器学习等理论，并且在风控、图像、文本、推荐、语音等一个或多个领域上有一定经验；4、熟练使用Spark/MPI/MR等计算平台，具备Keras/TensorFlow/Caffe/Theano/CUDA等一个或一种以上平台的使用经验优先；5、熟练使用Java/Scala//Python中的一种或多种编程语言，对数据结构和算法设计有较为深刻的理解；6、具备良好的数学建模能力和问题抽象能力，精通Python、R、Hive、MapReduce、Spark，有用Python、R、Spark、Hadoop做过数据处理、分析和建模的经验。优秀的数学模型能力，丰富的机器学习算法应用经验；7、有大规模图计算的算法开发经验、知识图谱/用户画像、金融风控行业经验者优先考虑；8、具备数据挖掘的相关专业知识和理论基础，对数据敏感，善于应用统计检验和可视化工具对数据进行分析处理，包括但不限于搜索算法/广告算法/推荐算法/NLP/图像算法/声学模型等领域的数据处理和挖掘经验。9、具备金融领域学术背景和统计或其他应用数学领域专业学术背景优先考虑。,北京市朝阳区北四环东路干杨树甲16号房地首华大厦9层,2018-03-18,北京,股份制企业,1000-9999人,1-3年,本科,20001-30000元/月
北京,机器学习,机器学习,98%,凯泰铭科技(北京)有限公司,18000-30000,北京,招聘中,http://jobs.zhaopin.com/279456887250113.htm,,1.计算机/数据/统计学专业本科及以上学历；2.扎实的统计学、数据分析、数据挖掘基础和统计建模能力；3.熟悉数据挖掘、机器学习、人工智能技术，尤其是关联分析、分类预测、聚类分析、回归分析、时间序列分析等常用分析方法；4.精通R、SAS、SPSS、Matlab等挖掘工具；5.有统计、数值计算、模型开发研究基础，风险模型构建经验者优先；,北京市朝阳区惠河南街国粹苑C座1031-1040,2018-03-18,北京,股份制企业,100-499人,3-5年,大专,18000-30000元/月
北京,机器学习,机器学习模型工程师,,马上消费金融股份有限公司,15000-30000,北京,招聘中,http://jobs.zhaopin.com/252519037253527.htm,1、设计并实施高可用模型，以预测多种结果；2、负责建立模型以解决现实问题；3、与产品、市场和业务分析人员协调合作开发模型来支持特定业务需求；4、指导团队内初级人员，提高管理效能。,1、全栈机器学习建模从数据清洗、数据预处理、变量构造、特征值提取、变量筛选到机器学习建模、模型评估、模型打包上线等。2、熟悉常用的机器学习模型和算法；3、有丰富的编程经验，熟悉R、Python等语言并有持续学习的兴趣；4、拥有数据结构和并行化的知识；5、有成功的可验证的实施案例者优先，有成功的机器学习竞赛经验者优先；,北京市朝阳区启阳路金辉大厦28层,2018-03-18,北京,股份制企业,1000-9999人,,本科,15000-30000元/月
北京,机器学习,机器学习-互联网运营中心-北京(001377),,中移在线服务有限公司,面议,北京,招聘中,http://jobs.zhaopin.com/705918026250712.htm,薪资面议1、负责文本处理、语义分析、分类聚类、情绪识别等算法的研发工作；2、负责基于文本语义的客服知识库构建，知识挖掘，以及构建基于知识库的智能应用；3、负责构建基于文本的智能应答系统以及优化提升。,教育硕士或以上学历；知识具备计算机软件、数据挖掘，机器学习，模式识别，信号处理等相关专业知识；技能有数据挖掘、机器学习相关算法的研究、开发和应用能力；熟悉某一种或几种脚本语言，具备良好的C/C++编程基础，有一定的项目经验；有过开源自然语言处理工具的使用经验者优先；熟悉自然语言处理领域基本理论和方法；对数据结构和算法设计有较为深刻的理解；经验具有3年以上研发经验。,北京,2018-03-18,北京,国企,10000人以上,3-5年,硕士,
北京,机器学习,产品开发-机器学习算法-渠道新技术团队-北京(001156),,中移在线服务有限公司,面议,北京,最近,http://jobs.zhaopin.com/705918026250528.htm,薪资面议岗位职责1、负责机器学习、深度学习、人工智能等等前沿技术跟踪与研究；2、负责深度学习基础架构与算法环境的设计与搭建；3、参与大规模机器学习、计算机视觉、图像处理，语义理解等等算法研发与优化；4、负责文本、语音及视频的智能客服系统及产品的架构设计与研发实现。任职资格,任职要求1、教育全日制硕士及以上学历；2、专业计算机、数学等相关专业；3、知识具备计算机软件、数据挖掘、机器学习、模式识别、信号处理等相关专业知识；精通机器学习/深度学习领域的专业知识；具备了扎实的科研学术功底；4、技能具备数据挖掘、机器学习、深度学习相关算法的研究、开发和应用能力；具备扎实的C/C++、Java或Python等编程基础；有过开源深度学习框架的使用经验者优先；对数据结构和算法设计有较为深刻的理解；具备统计机器学习、计算机视觉、语义理解检索、语音识别等技术经验，对数据结构和算法设计有较为深刻的理解；熟练阅读相关英,北京,2018-03-18,北京,国企,10000人以上,,本科,
北京,机器学习,产品开发(侧重机器学习算法)(实名制团队)北京(000845),,中移在线服务有限公司,面议,北京,最近,http://jobs.zhaopin.com/705918026250697.htm,薪资面议1、负责机器学习、深度学习、人工智能等等前沿技术跟踪与研究；2、负责深度学习基础架构与算法环境的设计与搭建；3、参与大规模机器学习、计算机视觉、图像处理，语义理解等等算法研发与优化；4、负责文本、语音及视频的智能客服系统及产品的架构设计与研发实现。,1、教育全日制硕士及以上学历；2、专业计算机、数学等相关专业；3、知识具备计算机软件、数据挖掘、机器学习、模式识别、信号处理等相关专业知识；精通机器学习/深度学习领域的专业知识；具备了扎实的科研学术功底；4、技能具备数据挖掘、机器学习、深度学习相关算法的研究、开发和应用能力；具备扎实的C/C++、Java或Python等编程基础；有过开源深度学习框架的使用经验者优先；对数据结构和算法设计有较为深刻的理解；具备统计机器学习、计算机视觉、语义理解检索、语音识别等技术经验，对数据结构和算法设计有较为深刻的理解；熟练阅读相关英文论文和专利，善于学习，能快速熟悉新的算法和提出自己的创见；5、对象应届毕业生及优秀往届毕业生。,北京,2018-03-18,北京,国企,10000人以上,,本科,
北京,机器学习,机器学习研发工程师,86%,北京易驾佳信息科技有限公司,30001-50000,北京,招聘中,http://jobs.zhaopin.com/328609083250102.htm,1、参与基于大数据机器学习产品的研发、设计工作，及机器学习平台的完善；2、负责模型发布、在线预测、模型监控、模型管理等相关功能设计、开发；3、对海量数据进行featureselection，combination等featureengineering工作；4、针对海量驾驶人行为数据，构建多维度画像；5、负责公司平台产品机器学习相关技术创新和技术实现。,1、机器学习/模式识别等相关专业方向，硕士或以上学历；2、熟悉C/C++及Python等语言，严密的数学思维、突出的数据、算法分析和归纳能力;3、DNN、CNN、RNN模型训练经验，熟悉常用的深度学习软件（如tensorflow、caffe、theano等）者；4、在深度学习领域有过理论研究或者实践经验，有语音识别、自然语言处理、人脸识别等项目经验；5、善于解决和分析问题，富有想象力和学习能力，良好的团队合作精神；6、有创造性思维，有推进人工智能的理想和使命感。,北京易驾佳信息科技有限公司,2018-03-18,北京,股份制企业,20-99人,1-3年,硕士,30001-50000元/月
北京,机器学习,机器学习/深度学习工程师-北京-02425,,博彦科技股份有限公司,20000-40000,北京,招聘中,http://jobs.zhaopin.com/000163976261889.htm,,1）在机器学习和深度学习领域有5年以上的实际工作经验，动手能力强2）有深度学习的实际应用经验和开发能力3）能够根据场景进行数学建模4）深入掌握机器学习和深度学习的原理5）较丰富的大数据运用经验,北京市海淀区西北旺东路10号院7号楼博彦科技大厦,2018-03-18,北京,上市公司,10000人以上,5-10年,不限,20000-40000元/月
北京,机器学习,机器学习与算法工程师/研究员,76%,深思考人工智能机器人科技(北京)有限公司,15000-30000,北京,招聘中,http://jobs.zhaopin.com/CC311521235J00027487411.htm,1、结合数据挖掘传统算法，机器学习浅层算法，深度学习深层算法在人工智能领域的产品中进行分类和预测；2、以上算法在图像识别、自然语言处理、舆情分析、语音识别等人工智能方面的应用；3、以上算法在高性能云计算服务器上的并行化和优化工作。,1、硕士及以上学历，计算机相关专业毕业；2、对机器学习的一般模型如分类、聚类、关联分析、预测等模型熟悉（LR，CART，SVM，NN，Bayesian，PCA，LDA等），理解一些常用的特征选择和矩阵分解的算法；3、熟悉深度神经网络和常用的模型，如RBM、CNN、DBN、Sparsecoding、RNN等，对常用的开源实现，如Caffe、Theano或ConvNet等有实践经验者优先考虑；4、熟悉深度神经网络在图像识别、自然语言处理方面的应用，有文本处理方面的经验者优先考虑；5、熟悉大规模并行计算的基本原理并具有实现并行计算算法的基本能力，熟悉Hadoop或者Spark架构者优先考虑，有过基于GPU指令的算法优化经验者优先考虑；6、良好的英文阅读能力，跟踪学术界和工业界的最新研究成果，并可以通过编程语言（C、C++、java、Python、Matlab）来编程实现，有编程实现过近几年深度学习相关论文算法者着重考虑；7、有创造性的思维，敢于超越技术极限，致力于研发一流的技术和产品；8、具有良好的沟通能力，和良好的团队合作精神。,北京市海淀区上地信息路12号中关村发展大厦B座203,2018-03-18,北京,民营,20-99人,,硕士,15000-30000元/月
北京,机器学习,机器学习,,北京奇虎科技有限公司,面议,北京,招聘中,http://jobs.zhaopin.com/467717611259459.htm,岗位职责-大数据量的用户行为数据的处理、清洗和挖掘，并持续迭代优化推荐策略-从数据中发现现有系统和算法的不足，提出改进的算法并推动实现-追踪业内前沿技术，结合业务特点，探索将前沿的算法技术应用于实际业务任职要求,任职要求-精通Java/C++/Python/perl（精通任意一种语言即可），有2年以上数据挖掘的经验-较好的数据挖掘、个性化推荐或自然语言处理经验，熟悉常用的机器学习算法-有较多的程序开发经验，对数据结构和算法知识应用熟练；有大数据处理经验者更佳；-良好的沟通和推动能力，主动性强，对个性化推荐有一定的兴趣,公司名称北京奇虎科技有限公司公司主页http//www.360.cn,2018-03-18,北京,上市公司,1000-9999人,3-5年,本科,
北京,机器学习,NLP工程师-机器学习/文本挖掘(001522),73%,链家网(北京)科技有限公司,20000-40000,北京,招聘中,http://jobs.zhaopin.com/300255137250719.htm,从海量文本数据，事件数据中挖掘构建房产领域问答库；对半结构数据，自然语言中进行信息抽取，包括分类，关键词提取，主题分析，黄反过滤、广告识别、情感分析、格调分级等工作；各类通过机器学习或文本分析进行驱动的需求。,扎实的数学基础，熟悉线性代数、统计、最优化等；对常用机器学习算法理解透彻；熟悉hmm，crf，maxent等算法，并熟悉这些技术在nlp领域中的应用；分词、实体识别、文本相关性、分类/聚类等方面的调研和开发工作经验；熟练使用数据分析工具、数据建模工具；熟悉c/c++，java，python，R及有相关工程经验的优先，有深度学习经验，使用过Caffe，TensorFlow，Theano等工具的优先，熟悉Hadoop/Hive/HBase/Spark/Storm等系统的优先，有实际成果并发表在国际顶级会议、期刊者优先。,北京市海淀区上地五街福道大厦链家网,2018-03-18,北京,民营,1000-9999人,1-3年,本科,20000-40000元/月
