城市,关键字,职位名称,反馈率,公司名称,职位月薪,工作地点,公布时间,职位链接,岗位职责,技能要求,公司地址,保存时间,公司地点,公司性质,公司规模,工作经验,学历要求,职业薪水
北京,机器学习,反作弊系统技术负责人,85%,北京摩拜科技有限公司,30001-50000,北京,招聘中,http://jobs.zhaopin.com/255179938251456.htm,1、负责反刷单和反作弊系统的设计和研发。2、负责反作弊策略和算法的设计和研发。3、跟踪反爬、反作弊技术的最新进展并应用于实践。,1、熟悉机器学习、数据挖掘、数据分析、分布式计算至少某一方面，有较深的理论研究和实践经验；2、熟悉常见的反作弊和反刷单技术，模型与规则，有反作弊工作实际经验；3、精通至少一门编程语言，熟练运用各种常用算法和数据结构，有独立的实现能力；4、具备优秀的逻辑思维能力，对解决挑战性问题充满热情，善于解决问题和分析问题；5、良好的团队合作精神，较强的沟通能力和学习能力；,北京市朝阳区麦子店街53号曼宁国际中心,2018-03-18,北京,民营,100-499人,5-10年,本科,30001-50000元/月
北京,机器学习,应届毕业生,84%,北京钛航信息技术有限公司,5000-10000,北京,招聘中,http://jobs.zhaopin.com/399562531250098.htm,开展软硬件的技术和产品开发，业务包括1、大数据技术方向；2、故障诊断、故障预测、机器学习方向；3、虚拟现实、增强现实和仿真方向；4、智能感知、智能检测方向；5、信息系统方向,1、计算机、通讯、软件、电子、控制专业的2018年应届毕业生；2、从事软件方向研究课题的人员，需具有C/C++/C#或JAVA/H5的开发基础；3、从事三维建模研究课题的人员，需具有3DMAX或Unity3D的开发基础；4、从事硬件研究课题的人员，需具有电子电路知识背景和设计工具基础；5、从事算法研究的人员，需具有神经网络、模式识别的知识背景；6、从事系统集成、产品设计方向的人员，需具有产品设计工具基础。,北京市海淀区杏石口路益园文创基地C2号楼405室,2018-03-18,北京,民营,20-99人,,本科,5000-10000元/月
北京,机器学习,算法工程师,84%,北京康夫子科技有限公司,20000-30000,北京,招聘中,http://jobs.zhaopin.com/CC276876539J00029479309.htm,,1、熟悉NLP领域的理论基础，具有NLP实战经验2、熟悉典型机器学习算法和工具3、熟练使用python、c/c++等至少一门语言，熟悉TensorFlow、Hadoop、数据库操作等优先4、具备一定的科研能力5、熟练掌握排序、查找算法，熟练使用基础数据结构具备以下经验者优先1、有海量数据处理、挖掘和分析经验者优先2、有信息抽取、问答推荐、文本生成、对话管理技术、知识图谱构建，情感分析、机器翻译、深度学习等研发经验者优先3、有RNN、CNN和LSTM等深度学习经验者优先我们的优势1、技术背景多位百度NLP大牛，内功深厚，领跑行业；2、医学背景北大医学博士，从业多年，精准把握医疗痛点；3、资金背景数千万A轮融资，未来几年吃喝不愁；4、薪资待遇年中奖励，年底三薪，股票期权；5、团队氛围人少精悍，低调务实，充分信任，珍惜人才；6、公司未来人工智能+全科医生，热门中的热门。我们给优秀的你提供了七险一金、无限免费零食＆饮料＆水果、带薪年假、餐补、年底14.5薪等所有你能想到和想不到的福利！,北京市西直门成铭大厦C座1603,2018-03-18,北京,股份制企业,20-99人,3-5年,本科,20000-30000元/月
北京,机器学习,图像算法工程师/资深/专家（深度学习）,,成都福尚博瑞企业管理咨询有限公司,30001-50000,北京,招聘中,http://jobs.zhaopin.com/CC320185432J00041486108.htm, 1.负责图像处理和模式识别的算法核心技术研发工作；2.参与互联网应用的图像技术的产品设计和开发工作；  , 1.计算机视觉、模式识别等相关专业硕士及以上学历；具备良好的沟通表达能力和团队合作意识2.熟悉计算机视觉和图像处理基本算法（目标检测、图像分割、图像识别、图像分类等），有相关项目经验或者较好的研究成果3.掌握机器学习领域的基本算法，在深度学习领域有实际项目经验4.具备良好的编程能力，熟练掌握C/C++编程语言，有Linux开发经验为佳。,海淀区,2018-03-18,北京,民营,20-99人,5-10年,博士,30001-50000元/月
北京,机器学习,Python大数据工程师,84%,北京源清慧虹信息科技有限公司,12000-24000,北京,招聘中,http://jobs.zhaopin.com/603166727250251.htm, 1.参与公司数据仓库架构设计与研发，建设的公共数据平台和服务系统，实现高质量数据的互通与共享； 2. 参与公司数据产品与应用的数据研发，发觉数据商业价值； 3. 结合实际业务问题，运用数据挖掘、机器学习领域的前沿技术，给出解决方案。 , 1. 精通 Linux/Unix 平台上的 C/C++/Java/Python 编程，对数据结构和算法有较为深刻的理解； 2. 有大型在线应用系统的开发经验，熟悉 Web 开发相关技术； 3. 熟悉分布式计算相关技术，有大数据处理经验； 4. 具备优秀的逻辑思维能力，对解决挑战性问题充满热情，善于解决问题和分析问题，具有良好的沟通能力和团队合作精神。 有下列经验之一者优先 -有海量数据的处理经验，熟练使用 Hadoop、Hive、Spark 等分布式计算工具； -有机器学习 /数据挖掘理论和技术基础； -有高性能、高并发、高可用性、高扩展性系统架构设计经验。,北京市海淀区上地东路1号盈创动力大厦,2018-03-18,北京,股份制企业,20-99人,3-5年,本科,12000-24000元/月
北京,机器学习,推荐算法工程师,,银河互联网电视有限公司,20000-40000,北京,招聘中,http://jobs.zhaopin.com/CC514450428J00024207814.htm,1) 负责视频推荐算法和架构的研发设计；2) 负责建立完整的开发、验证流程,1) 2年以上机器学习工作经验，本科及以上学历，计算机、软件工程、数学等相关专业；2) 精通java/scala语言，精通spark编程，有MLIB的实际使用经验；3) 熟悉hadoop生态环境和相关技术，yarn、hdfs、kafka、spark、hive、impala、hbase等；4) 熟悉Linux操作系统，熟悉shell、python编程；5) 熟悉常用的推荐算法，LR、SVD、PCA、ALS、GBT、SVM等；6) 5年以上工作经验；,北京市丰台区南四环西路188号（丰台总部基地）十八区7号楼中国广播网8层,2018-03-18,北京,国企,20-99人,5-10年,本科,20000-40000元/月
北京,机器学习,数据挖掘工程师,84%,华兴创信(北京)科技有限公司,15000-25000,北京,招聘中,http://jobs.zhaopin.com/531520584250024.htm,1、针对公司海量保险数据和互联网数据对汽车驾驶风险进行测算、车联网定价、精准营销和精准风控等大数据应用项目。 2、协助对项目实施中遇到的算法性能瓶颈进行诊断和改进； ,1、本科及以上学历，  2、2年及以上工作经验 3、精通机器学习基本算法，应用过深度学习算法 4、熟悉Linux平台上的编程环境，精通Python 5、大型互联网公司数据挖掘项目开发经验优先  6、参加过Kaggle、天池等大数据竞赛项目的优先 7、学习能力强，拥有优秀的逻辑思维能力，工作认真负责，沟通能力良好。 ,北京市,2018-03-18,北京,民营,20人以下,3-5年,本科,15000-25000元/月
北京,机器学习,数据挖掘工程师,83%,北京瓴岳信息技术有限公司,18000-30000,北京,最近,http://jobs.zhaopin.com/CC312211389J00027436113.htm,,,北京市朝阳区团结湖中青大厦19层1903,2018-03-18,北京,民营,100-499人,1-3年,本科,18000-30000元/月
北京,机器学习,模型/算法工程师,,国美金控投资有限公司,15001-20000,北京-朝阳区,招聘中,http://jobs.zhaopin.com/252551830250095.htm,1.能够根据业务需要，选择合适的机器学习算法，并优化算法，并根据相应指标持续改进。2.工具开发构建适合金融行业内部使用的、可复用、可快速实施的大数据分析与预测工具包。3.能够理解互联网金融风控业务，跟踪学习并利用业内最新的风控建模手段。,1.统计、数学、计算机相关专业，本科及以上学历；2.熟练使用SAS，Python、R、C++、Java中的至少一种编程语言；3.精通LR，decisiontree等常用机器学习算法的至少一种；4、加分项有过评分卡的建模经历或风控模型的开发经历者，优先。,北京市朝阳区霄云路26号鹏润大厦,2018-03-18,北京-朝阳区,其它,1000-9999人,,不限,15001-20000元/月
北京,机器学习,算法实习生,82%,北京艾漫数据科技股份有限公司,4001-6000,北京,招聘中,http://jobs.zhaopin.com/465816918250325.htm,,,北京市朝阳区酒仙桥北路甲10号电子城IT产业园201号楼E门2层,2018-03-18,北京,上市公司,20-99人,,本科,4001-6000元/月
北京,机器学习,Python爬虫工程师,82%,北京易联戴维企业管理服务有限责任公司,10001-15000,北京,招聘中,http://jobs.zhaopin.com/284702016250407.htm,1、设计和开发分布式网络爬虫系统，并进行多平台信息抓取和分析工作；2、负责网页信息抽取、数据清洗等研发和优化工作；3、负责抓取数据的深度提取和挖掘。,1、精通Python编程语言；2、精通网页抓取原理及技术，精通正则表达式，从结构化的和非结构化的数据中获取信息；3、熟悉Mysql，有过数据库调优和海量数据存储经验优先；4、具有大型web登录分析和搜索相关技术研发经验者优先； 5、具有数据挖掘、自然语言处理、信息检索、机器学习背景者优先。,北京市朝阳区,2018-03-18,北京,民营,100-499人,1-3年,本科,10001-15000元/月
北京,机器学习,算法实习生,,北京悦畅停车发展有限公司,2001-4000,北京-朝阳区,招聘中,http://jobs.zhaopin.com/420171937250150.htm,1、参与图像识别与机器学习方面的算法研究工作；2、参与汽车与车流相关的海量数据挖掘工作；,1、熟练掌握一门语言（java、python、scala、C/C++）；2、熟悉常用机器学习和数据挖掘算法，包括但不限于决策树、支持向量机、线性回归、逻辑斯谛回归以及神经网络等算法；3、有特征处理、变量清洗、特征值构造等经验；4、有过爬虫相关经验；5、熟练掌握SQL语言，有实际应用经验；6、优秀的沟通能力，有创新精神，乐于接受挑战，能承受工作；7、全日制本科，计算机相关方向，2018、19年毕业生，每周实习不少于4天。,北京市朝阳区朝阳门外大街甲6号4层1座401,2018-03-18,北京-朝阳区,民营,1000-9999人,,本科,2001-4000元/月
北京,机器学习,数据开发工程师,80%,同源数智(北京)科技有限公司,12000-22000,北京,招聘中,http://jobs.zhaopin.com/542644332250028.htm,1、负责设计和搭建全产品线的数据采集、存储、清洗、挖掘、API服务整体技术系统架构；2、负责规划数据挖掘平台的整体流程，并参与用户产品和数据产品的决策；3、与业务部门密切配合，寻求数据层面的业务价值，利用数据分析结论推动产品优化；4、综合各项目中的通用需求，开发标准化的的工具和产品；5、研究大数据技术领域最新进展，并进行应用和实践；,1、3年以上工作经验，数学、统计学、计算机信息类等专业背景；2、对数字，数据敏感，具备良好的逻辑思维能力，能够从海量数据中发现有价值的规律；3、熟悉数据结构，熟悉数据挖掘和机器学习算法等常用算法；4、熟悉Linux操作系统，至少熟练使用Java、Scala、Python、C等语言中的2种编程；5、熟悉Hadoop、Hbase、Spark等原理，2年以上实战经验，熟悉分布式计算实施过程中的各种问题，有至少1年以上实际大规模的数据处理和BI工作经验；6、熟悉常见的分布式存储相关技术，包括HDFS，HBase、Hive、Redis、mongodb、Flume、Kafaka、Sqoop、Zookeeper等；7、具备良好的团队意识和沟通能力，学习能力和主动性强；,北京市朝阳区和平街14区甲16楼华表大厦518,2018-03-18,北京,民营,20-99人,5-10年,本科,12000-22000元/月
北京,机器学习,数据分析师,80%,海外网传媒有限公司,8000-12000,北京-朝阳区,最近,http://jobs.zhaopin.com/655055725250159.htm,1、负责搭建舆情分析业务体系，协助大数据工程师完成数据仓库建模；2、负责用户调研、及用户行为分析等数据商业价值挖掘工作；3、利用数据挖掘、数据分析、机器学习相关算法，建立数据挖掘模型，提取关键数据的特征，为公司业务发展决策提供数据支撑。,1、统招本科以上数学、统计学、信息管理、计算机等相关专业毕业，1年以上相关工作经验，要求英语能力强，至少能浏览英文网站和英文资料；2、熟悉Linux操作，熟练掌握Python语言以及基于Python的数据处理框架；3、熟悉R、SAS、SPSS、Matlab等数据挖掘工具；4、熟悉常见机器学习算法（如逻辑回归、SVM、神经网络、决策树、贝叶斯，协同过滤，关联关系等）；5、熟练Redis、HBase等NoSQL数据库；6、熟悉Hive/Mahout/SparkMlib等分布式开源项目中的一种或多种。,北京市朝阳区金台路西路2号院人民日报社院内,2018-03-18,北京-朝阳区,国企,100-499人,1-3年,本科,8000-12000元/月
北京,机器学习,AI 人工智能定岗生,80%,福建滴咚共享科技股份有限公司,8000-16000,北京,最近,http://jobs.zhaopin.com/286304536250279.htm,1、利用深度学习技术进行前沿人工智能技术研发；2、机器学习平台的选型，参与框架搭建，开发及优化；3、完成机器学习/深度学习/人工智能相关算法实现，算法优化和性能评估；4、进行特征挖掘、标签抽取、模型优化、算法评估等工作；5、参与推荐系统、广告系统的算法及架构优化；6、参与核心代码的书写，解决项目开发过程中的重大技术问题。,1、统招本科及以上学历，计算机、统计、数学相关专业；2、熟悉数据结构和算法，熟练使用python/java/scala一种或多种；3、对机器学习算法有强烈的兴趣，乐于进行深入的研究和探索。具备较强的逻辑分析能力、解决问题的能力，善于学习新事物；4、了解深度学习，模式识别、机器学习、数据挖掘基本算法，有相关项目经验优先；5、有AI相关工作经验者优先；6、接受优秀应届毕业生。,福建省福州市闽侯县上街镇海西高新科技园万福中心2号楼5层,2018-03-18,北京,民营,20-99人,,本科,8000-16000元/月
北京,机器学习,数据工程师,80%,北京美至网络科技有限公司,30001-50000,北京,招聘中,http://jobs.zhaopin.com/254462287250281.htm,1、用机器学习/统计学习解决营销建模问题；2、负责推荐引擎，统计学模型，以及大数据产品和服务的核心模型与算法的创新研究和实现；3、应用机器学习、统计预测等前沿技术分析和挖掘客户海量数据（用户，用户行为以及销售等）；4、参与大数据预测模型的产品和服务的产品设计和技术架构设计搭建与建模。,1、本科及以上学历，机器学习或统计学习建模领域拥有实际工作经验；2、良好的逻辑思维能力，能够从海量数据中发现有价值的规律，熟悉大规模数据挖掘、机器学习等基本算法； 3、熟悉Spark、Hadoop等分布式计算技术，具有R、Python等统计分析技能优先； 4、有广告营销算法、推荐算法、爬虫、dmp等相关领域研究或实践经验者优先；5、具备良好的学习能力和沟通交流能力，能够迅速熟悉业务、融入团队，有团队管理经验优先。,北京市朝阳区曙光西里甲1号B1002,2018-03-18,北京,民营,20-99人,3-5年,本科,30001-50000元/月
北京,机器学习,图像视觉定位研发工程师,80%,北京布科思科技有限公司,10000-20000,北京-海淀区,招聘中,http://jobs.zhaopin.com/336674986250046.htm,1、研究并开发前沿图像特征提取，匹配算法2、基于3D地图和单目\双目摄像头的位置追踪算法 ,1、计算机、图像处理、模式识别、机器学习等相关方向硕士及以上学历；2、熟练掌握C/C++语言，具备linux环境下编程能力。3、精通OPENCV和BOOST/STD库。4、有扎实的数学基础、具备模式识别、图像处理、计算机视觉等方面良好理论基础。5、熟悉目标识别技术，包括物体检测和识别、RGB-D图像的语义分割等。 ,北京市海淀区清河建金商厦,2018-03-18,北京-海淀区,民营,20-99人,,硕士,10000-20000元/月
北京,机器学习,算法研究员,79%,北京人人金服投资管理有限公司,15001-20000,北京,招聘中,http://jobs.zhaopin.com/283322187250001.htm,1.利用统计分析建模、机器学习算法、自然语言处理等技术方法，针对国内外金融市场产品，研发量化投资策略；2.包括但不限于量化FOF基金分析与投资策略研发；债券等固收产品的信用风险量化分析；股票、期货量化投资策略研发；金融财经舆情系统研发等；3.进行量化投资模型的研发与优化，进行程序化交易策略的代码开发，并协助客户和投资经理进行投资决策；4.参与部门日常管理和服务、软硬件建设、团队建设等各方面工作。,1.硕士及以上学历，计算机、金融工程，统计学，数学、物理等相关专业；2.熟练掌握至少一种编程语言（Python/JAVA/C++/C/R等，其中Python优先）； 3.有机器学习、数据挖掘、自然语言处理等经验者优先；4.有量化投资，FOF基金筛选，股票、期货量化交易经验者优先；5.熟悉MySQL，SqlServer等数据库的使用，能熟练使用SQL语言者优先；7.具备证券从业资格，CPA、CFA等资格证书者优先；6.有ACM竞赛获奖经历优先，有国际高水平会议论文者优先；8.精力充沛、乐于分享与交流、抗压能力较强、注重工作实效；,北京市朝阳区光华路9号SOHO3Q一层,2018-03-18,北京,民营,20-99人,,硕士,15001-20000元/月
北京,机器学习,风控建模师,79%,北京瑞钱宝资产管理服务有限公司,15000-30000,北京-西城区,招聘中,http://jobs.zhaopin.com/317033432250072.htm,1.搭建面向个人信贷产品风险管理体系提供信用风险预测模型，包括但不限于申请评分卡、行为评分卡等；2.建立个人信用评分体系，负责各类评分卡的建模、开发、跟踪、实施，并不断改进评分效果；3.建立和维护信贷资产质量分析体系，设计和开发反欺诈数学模型，建立完善的欺诈检测系统，实现信贷资产质量监测预警系统；4.根据不同贷款产品的风险特征，设计并开发风险定价模型，并开展相关风险计量工作。,1.本科及以上学历，2年以上工作经验；2.熟悉各类评分卡模型，包括申请评分卡、催收评分卡、反欺诈评分卡，熟悉机器学习模型；3.SAS，Python，等数据挖掘软件至少精通1种。4.对数据有敏锐的洞察力，思维严谨，逻辑性强；,北京西城区阜外大街外经贸大厦5层,2018-03-18,北京-西城区,民营,20-99人,1-3年,本科,15000-30000元/月
北京,机器学习,算法工程师（人脸识别与视频处理）,100%,北京佳仕汇管理咨询有限公司,20000-40000,北京,招聘中,http://jobs.zhaopin.com/667946122250589.htm,1、负责计算机视觉方向前沿问题的研究，结合实际应用场景，提供技术解决方案；2、使用人脸识别技术辅助影视特效应用；,1、计算机视觉/机器学习/深度学习相关专业，硕士及以上学历；2、扎实的图像/视频处理算法理论基础，熟悉3D建模、特征处理/CG动画编程其中至少一项；3、熟悉C/C++/python编程语言，熟练使用TensorFlow/Keras/PyTorch/Caffe深度学习框架，熟练使用OpenCV等计算机视觉框架；,北京市海淀区清河同源大厦11层,2018-03-18,北京,民营,20-99人,,不限,20000-40000元/月
北京,机器学习,自然语言处理工程师,100%,北京因果树网络科技有限公司,20001-30000,北京-海淀区,最新,http://jobs.zhaopin.com/241755385250163.htm, 1.负责分词、命名实体识别、同义词挖掘、用户意图识别等NLP模块；     2.负责机器学习rank模型优化、迭代； 3.负责机器学习预测模型优化、迭代； 4.负责金融投融资市场知识图谱挖掘。, 1.计算机本科及其以上学历，三年以上research经验； 2.有较强的算法基础和c/c++编码能力，熟悉linux环境，熟悉python、shell编程； 3.有丰富NLP、机器学习、数据挖掘、Query分析、用户画像、广告ctr预测等至少一种背景和经历，有在国内著名搜索公司工作经验优先； 4.有丰富CRF、词性标注、主题模型、CNN、DNN、GBDT等经验； 5.有充分的使命必达、结果导向意识和素养，对创业充满热情，拥有创业经历者优先。,北京市海淀区互联网金融中心10层,2018-03-18,北京-海淀区,股份制企业,20-99人,,本科,20001-30000元/月
北京,机器学习,数据分析师,78%,诺远科技发展有限公司,15000-25000,北京,招聘中,http://jobs.zhaopin.com/CC275470883J00027398311.htm,1.利用python语言完成数据报表的开发。包含不限于模型表现、信用审核、贷中监控、贷后催收数据的日报，周报和月报，以及相关展示ppt的制作。2.监控各类报表，完成日常数据分析工作。梳理各金融产品逻辑，固化数据项，形成数据单元，完善报表功能，优化报表呈现。,1.具有较强的业务理解和数据分析能力，利用机器学习和复杂网络技术解决实际问题；2.熟练掌握Excel和Python，有处理各类结构化或非机构化数据的实际经验；3.在数学、运筹学、统计学等相关领域2年以上工作经历，硕士及以上学历优先。,朝阳区向军北里28号院瀚海文化大厦副楼汉富金控,2018-03-18,北京,民营,1000-9999人,3-5年,本科,15000-25000元/月
北京,机器学习,图形图像算法工程师,77%,北京全电智领科技有限公司,15001-20000,北京-海淀区,招聘中,http://jobs.zhaopin.com/458491921250119.htm, 利用计算机视觉技术，对视频图像进行关键元素识别及提取，进行数字化处理后便于后期比对分析。项目中会使用到机器学习，深度学习等最前沿的技术。 工作内容1.负责对类智能手机摄像头拍摄图像进行特征提取，比对识别，区块检测，像素分割等多种操作2.负责数字图像视觉算法的研发，包括而不限于图像处理，图像识别，物体检测等3.实现高准确度的机器图像操作算法，并通过深度学习不断优化算法准确率4.相关专利的编写  ,1.熟悉手机端的图像算法或者视频算法的开发2.图像处理、计算机视觉等相关专业博士或3年以上工作经验硕士；3.熟练使用opencv及相关图形图像算法库工具，熟悉OCR识别的相关算法研究，包括目标跟踪、图像匹配、图像特征提取、图像识别等算法4.精通c/c++，matlab或python语言，能独立编程实现算法及仿真验证；5.具备扎实的图形图像模式识别方面理论知识，掌握常见的机器学习算法（SVM、BP、CNN等）、图像特征提取算法（sift、surf、hog、lbp、haar等）；6.对图像识别算法、深度学习具有较为深入的研究，数学基础优异，具有良好的数学思维训练和逻辑思考能力7.至少熟悉caffe、mxnet、TensorFlow等一种深度学习框架者优先8.熟练阅读相关英文论文和专利，善于学习，能快速熟悉新的算法和提出自己的创见；,北京市海淀区中关村梦想实验室9层,2018-03-18,北京-海淀区,股份制企业,20-99人,3-5年,硕士,15001-20000元/月
北京,机器学习,AI行业专家（海航云）,100%,天津天海投资发展股份有限公司,30001-50000,北京-东城区,招聘中,http://jobs.zhaopin.com/CC292857738J00024370515.htm,1.给予技术、产品及业务发展方向以合理建议；2.分享行业研究成果与成功经验；3.为公司产品和技术代言。,1.计算机视觉、智能语音技术、自然语言理解、机器学习、知识图谱等人工智能领域及细分领域的技术领军人物，在所属行业有相当的技术影响力和号召力；2.认同海航企业文化和价值观，愿意为海航事业贡献力量。,和平里雍和航星园8号楼3层,2018-03-18,北京-东城区,合资,500-999人,5-10年,本科,30001-50000元/月
