城市,关键字,职位名称,反馈率,公司名称,职位月薪,工作地点,公布时间,职位链接,岗位职责,技能要求,公司地址,保存时间,公司地点,公司性质,公司规模,工作经验,学历要求,职业薪水
北京,机器学习,软件开发岗,,中国民生银行股份有限公司,面议,北京,招聘中,http://jobs.zhaopin.com/000067551251625.htm,负责制定全行系统架构规划、方案设计、项目管理及关键技术组件的开发等，根据业务需求进行系统的技术方案设计、功能开发、测试及产品交付等。,1.年龄40周岁（含）以下，全日制大学本科及以上学历；2.满足如下任一要求即可(1)架构管理5年及以上技术架构设计与技术管理工作经验；精通软件工程和大规模软件开发方法，精通现代化软件设计方法和算法理论；具有大规模、分布式系统相关开发经验者优先。(2)项目管理5年及以上软件开发项目管理经验，熟悉银行业信息科技相关项目管理规章制度及流程；熟悉银行业软件项目外包资源管理，对开发资源管理工作具有一定的见解及想法。(3)分布式技术熟悉轻量级J2EE开源框架并熟练运用；熟悉分布式系统基本原理，掌握至少一种开源分布式相关技术并熟练运用；具有分布式开源服务框架、服务治理、分布式数据库及中间件、分布式消息中间件、主流分布式架构设计或开发经验者优先。(4)Java/C语言开发具有5年及以上开发工作经验，精通Java/C/C++语言；熟练使用SQL语言，熟悉至少1种主流数据库。(5)大数据开发具有大数据领域3年及以上工作经验；熟悉分布式系统基本原理，掌握至少一种大数据技术相关组件并熟练运用；具有大数据应用程序的开发和优化经验者优先。(6)机器学习3年及以上机器学习或者数据挖掘经验；精通机器学习模型开发和调优方法；掌握至少一种编程语言（如R\Python\Java）。(7)web前端开发3年及以上Web前端开发工作经验，具有HTML5/CSS3等移动端Web页面开发经验，具有css，js前段性能优化经验，具备解决多浏览器兼容问题的能力；深刻理解Web标准，熟练掌握Javascript常用类库使用。(8)IOS/Android开发3年及以上IOS/Android平台商业软件开发经验；IOS方向需熟练掌握Objective-C编程语言、IOSSDK相关技术开发及应用，具备一定的C、C++或前端开发基础；Android方向需精通Android开发技术，熟悉主流的Android开发平台和框架、Android下网络通信机制，对Socket、TCP/IP以及无线通信协议有一定理解和经验；个人在Appstore或安卓市场等拥有应用者优先。(9)UI设计视觉设计、交互设计、工业设计或平面设计等相关专业，3年及以上设计相关工作经验；精通各种视觉效果的呈现，熟练使用必备专业软件；对交互设计过程有深入的了解，具备独立完成设计的能力。(10)功能测试具有测试需求分析、案例编写等实践经验；熟悉软件工程理论及质量管理理论方法；熟悉软件测试方法，熟悉至少一种测试管理工具及软件开发语言；了解数据库原理，熟练使用SQL。(11)视频语音技术具有音视频相关项目开发经验（如远程坐席、视频会议、直播、视频监控等），熟悉音视频流媒体相关技术，熟悉H.264/AAC编码标准、主流和新兴流媒体网络传输协议。,北京,2018-03-18,北京,民营,10000人以上,5-10年,本科,
北京,机器学习,大数据开发工程师,,京东集团,面议,北京-朝阳区,招聘中,http://jobs.zhaopin.com/192921312309491.htm,1、负责京东商业智能平台的开发；2 对京东海量电商数据进行数据挖掘和分析；,1 熟练掌握Java/Scala，熟悉Shell/Python等一门以上脚本语言，并灵活运用到实际工作中及解决技术问题；2 熟悉两种以上大数据处理工具和技术（如Hadoop/Spark/Hive/Hbase/Kafka/Storm），有实际大数据分析处理项目经验；3 熟悉分布式系统的设计和应用；4 从事过机器学习、数据挖掘、统计分析、推荐等算法相关的项目经验者优先；5 本科以上学历，计算机相关专业，名校优先；6 3年以上工作经验，有java web开发经验，互联网行业从业者优先；,北辰世纪中心A座,2018-03-18,北京-朝阳区,外商独资,20-99人,5-10年,本科,
北京,机器学习,算法工程师(021631),,京东金融,面议,北京-大兴区,招聘中,http://jobs.zhaopin.com/192921312297837.htm,1、负责信用风险、推荐系统管理后台开发；2、负责大数据推荐算法研发。,1、熟悉Linux开发，良好的编程能力和代码风格，熟练掌握python、java或者C/C++编程，熟悉scala编程优先；2、在推荐、搜索算法、自然语言处理或任一相关领域有一定理解或应用经验，有hadoop、spark应用经验者优先；3、熟悉常用数据挖掘、机器学习模型，有深度学习理论与实践经验者优先；4、对常用推荐算法有较深入了解，有实际上线算法调优经验优先；5、对商业和业务逻辑敏感，具备良好的逻辑分析能力、组织沟通能力和团队精神，乐于分享、勇于承担。,北京市大兴区亦庄京东大厦,2018-03-18,北京-大兴区,外商独资,1000-9999人,5-10年,本科,
北京,机器学习,高级数据挖掘工程师(017116),,京东金融,面议,北京,招聘中,http://jobs.zhaopin.com/19292131290295265000.htm,1、基于京东海量的数据基础，通过机器学习等手段，优化现有风控、反欺诈、账户安全体系，精确识别经过层层伪装的恶意行为，打造具备良好用户体验的数据产品体系；2、深入地挖掘分析京东电商、消费金融、京东支付的客户属性及行为数据，量化客户类型行为特征；3、深入地分析各类风险案件，设计并实现反欺诈、账户安全场景下的风险评价模型；4、研究量化客户的关联类型、关联客户的距离。,1、硕士以上学历，较强的计算机、数学和统计学背景；2、扎实的理论和算法基础，能够在Spark环境下快速高效的实现常用机器学习模型和算法；3、拥有模块化编程思想，有大型数据挖掘项目经验者优先；4、拥有大规模数据处理和分析经验者优先；5、良好的学习意愿和学习能力，能够快速掌握工作所需技能，对海量数据在金融场景下的应用感兴趣。更多职位动态，敬请关注微信公众号京东金融招聘。,北京亦庄,2018-03-18,北京,外商独资,1000-9999人,3-5年,硕士,
北京,机器学习,量化产品经理(039887),,京东金融,面议,北京-大兴区,招聘中,http://jobs.zhaopin.com/192921312309774.htm,1、用数据及模型算法驱动各业务平台用户运营（银行+、借钱平台），辅助提升平台业务指标； 2、通过数据算法为用户运营、活动运营、产品运营提供更科学、更精细化的优化建议； 3、对量化运营的海量数据，应用数据分析，数据分析建模、数据挖掘、机器学习等技术有深入的理解； 4、独立搭建设计客户洞察、量化运营分析平台，辅助各业务线平台运营，不断标准化产品为外部银行机构提供量化运营工具。,1、计算机，数学，数据挖掘等相关专业本科及以上学历，3年以上相关工作经验； 2、扎实的计算机及数学基础（数据结构、数据挖掘等），良好的逻辑思维能力，擅长算法与建模； 3、熟悉大规模数据挖掘、机器学习、概率统计和优化算法，了解量化运营方法论及工具产品实践经验； 4、对Hadoop/Spark等分布式计算平台有丰富的实践经验； 5、具有良好的逻辑分析、语言表达和文档编写能力。 更多职位动态，敬请关注微信公众号“京东金融招聘”,北京市大兴区经海路亦庄京东总部A座,2018-03-18,北京-大兴区,外商独资,1000-9999人,3-5年,本科,
北京,机器学习,风控产品经理-数据产品方向(012952),,京东金融,面议,北京-大兴区,招聘中,http://jobs.zhaopin.com/19292131290292958000.htm,1、负责京东白条、京东支付、京东钱包等风控数据产品的设计，制定数据规划和阶段性目标；2、制订数据挖掘和数据产品开发计划，督促各项目成员按计划完成产品的上线；3、与客户、业务部门保持充分沟通、协作，确保达成既定产品目标；4、根据用户行为制定和优化反欺诈策略、产品，制定用户认证策略；5、与客户及业务线配合推动各风控策略，建立健全风险防控机制和体系。,1、本科以上学历，统计、应用数学、金融、计算机等相关专业背景优先，3年以上互联网产品经理工作经验；2、在机器学习，数据挖掘，信息检索，自然语言处理，推荐系统，用户行为分析等一个或多个算法领域有项目经验；3、对账户安全、交易风险控制、垃圾广告以及欺诈控制等至少一个风控领域有自己的思考；4、具备良好的责任心，沟通协调能力、推动执行能力、学习能力，工作细致严谨；5、熟悉各种需求分析工具，能熟练运用office、axure、uml等工具，完成PRD与Demo制作，并最终形成产品设计。,北京市大兴区亦庄京东大厦,2018-03-18,北京-大兴区,外商独资,1000-9999人,3-5年,不限,
北京,机器学习,人脸识别算法工程师(017617),,京东金融,面议,北京,招聘中,http://jobs.zhaopin.com/192921312295527.htm,1、人脸识别，活体检测，图像识别等相关前沿技术的研究；2、对现有算法基于特定场景进行优化和改进，负责相关算法的产品化落地。,1、计算机，数学，物理等相关专业，数学基础扎实，熟悉常用的机器学习算法；2、有图像处理，人脸识别，模式识别相关的研究或工作经验；3、熟练C，C++等（至少一种）计算机编程语言，可以利用python等快速实现相关算法；4、熟悉caffe等深度学习框架，有较好的相关研究成果（学术论文，算法竞赛）优先考虑；5、熟练掌握计算机视觉领域基本方法，且具有一定的相关项目经验（具有人脸识别、物体检测识别、3D建模等相关算法研发经验优先；6、熟练掌握机器学习领域基本方法，且具有一定的实用经验（熟悉boosting、svm、神经网络等算法，有深度学习实用经验优先）。更多职位动态，敬请关注微信公众号京东金融招聘。,北京,2018-03-18,北京,外商独资,1000-9999人,3-5年,硕士,
北京,机器学习,算法工程师(027192),,京东金融,面议,北京-大兴区,招聘中,http://jobs.zhaopin.com/192921312301567.htm,1、分析京东金融移动端用户数据和金融产品数据并持续挖掘数据的商业价值；2、深入挖掘海量用户的行为、属性，建立用户画像标签体系，建立相关的预测模型、定价模型等，为商业应用提供数据驱动的服务与产品，并推进相关数据产品建设；3、主导京东金融中台的算法研发，通过智能算法构建用户数据管理平台，负责其中的核心算法和数据挖掘方向，包括潜客挖掘、流量策略、激活、LTV、客户忠诚度提升等；4、主导京东金融FSP的算法研发，通过大数据和算法为商家经营提效，包括选品、供应链优化、产品推荐等；5、深入理解金融业务，协助搭建金融服务/产品数据模型，为业务发展提供数据支持。,1、三年以上数据挖掘、机器学习、搜索、推荐或广告系统相关算法工作经验；2、计算机、数学、统计等相关专业本科及以上学历；3、精通至少一种数据分析/挖掘软件，如R/Python/SAS/Mahout等；4、熟悉至少一种以下数据库操作，如Hive/Mysql/Hadoop/Oracle等；5、至少一门脚本开发语言(如python/shell/ruby/javascript/tcl/perl等)使用经验；6、有互联网行业、移动互联网行业数据分析挖掘从业经历者优先；7、对数据驱动业务有一定理解，对数据与业务方面有足够的敏感性，有较强的逻辑分析能力，有较强的独立思考能力；8、具备良好的沟通能力和团队合作精神，能独立完成挖掘项目的规划和实施。更多职位动态，敬请关注微信公众号“京东金融招聘”。,北京市大兴区亦庄京东大厦,2018-03-18,北京-大兴区,外商独资,1000-9999人,3-5年,本科,
北京,机器学习,大数据开发师,,京东商城,面议,北京-大兴区,招聘中,http://jobs.zhaopin.com/192921312308765.htm,1.负责数据分析、加工、清理、处理程序的开发2.从事海量数据分析、挖掘相关工作3.负责数据相关平台的搭建、开发、维护、优化 ,1.计算机相关专业，本科及以上学历，5年以上Java开发工作经验，学习能力突出；2.熟悉hadoop生态系统内常见项目的使用（hdfs、hive、hbase、spark、zookeeper，yarn等），具有MapReduce开发经验，有实际大数据项目经验优先3.熟练掌握Oracle、MySql等主流数据库4.精通JAVA，熟悉基于J2EE的WEB架构设计，熟悉Web开发流程，有丰富的WebMVC（Struts、Spring，Hibernate等）开发经验；5.熟悉Linux/Unix系统环境下的操作；熟悉Tomcat等应用服务器的配置和优化；6.具有良好的沟通能力、组织能力及团队协作精神，有较强的分析和解决问题的能力；加分项1.有海量大数据开发经验2.有Hadoop、Spark、HBase深入源代码分析经验3.熟悉机器学习、数据挖掘、分布式计算4.基础能力+学习能力特别优秀者,北京市大兴区京东亦庄总部,2018-03-18,北京-大兴区,外商独资,1000-9999人,3-5年,本科,
北京,机器学习,数据创新-数据分析专员(10019072),,宜信,10001-15000,北京,招聘中,http://jobs.zhaopin.com/371111518311456.htm,,Must1.本科及以上学历，数学、统计、物理、金融、计量、管理科学、工程等相关专业。2.很强的责任心、优秀的沟通能力、良好的逻辑思维以及团队协作意识。3.扎实的统计基础知识，会使用excel和SQL语言，以及SAS、R、Python等分析工具中的一种。4.2年以上数据分析工作经验，有信贷行业经验者优先。Nicetohave1.有风险模型和策略模拟的开发和实施的相关经验。2.熟悉机器学习的相关算法及其应用。3.会使用Tableau、Highcharts、D3.js等数据可视化工具。,北京朝阳区soho现代城,2018-03-18,北京,民营,10000人以上,,不限,10001-15000元/月
北京,机器学习,风险管理专员(10022550),,宜信,10000-20000,北京,招聘中,http://jobs.zhaopin.com/371111518317845.htm,,1.硕士及以上学历，计算机、电子、统计等相关专业；2.扎实的机器学习理论基础，熟练掌握机器学习和数据挖掘相关算法，有实践经验者优先；3.扎实的编程基础，至少熟练掌握一种语言（C/C++/Java/Python等）；4.熟悉MySQL、HBase等数据库，熟悉大数据处理的常用技术，有处理海量数据经验者优先；5.具备良好的沟通能力和团队合作精神。,北京市朝阳区建国路88号SOHO现代城,2018-03-18,北京,民营,10000人以上,1-3年,不限,10000-20000元/月
北京,机器学习,深度学习算法工程师,,清华大学微电子学研究所,10000-20000,北京,招聘中,http://jobs.zhaopin.com/120387148250118.htm,1、深度学习相关前沿算法的研究；2、海量数据的分析和挖掘工作，包括特征提取、模型训练、数据分析、可视化处理；,1、硕士、博士学历，计算机、电子、自动化、数学、信息科学等相关专业；2、熟悉常用深度学习和机器学习算法，对CNN，LSTM，RNN，Faster-RCNN，ReinforcementLearning至少熟悉其中1种；3、熟练使用Tensorflow，Caffe，MXNet等主流机器学习计算框架。4、Caffe等平台上训练过网络，熟悉AlexNet，VGG，ResNET等网络架构；5、对NIPS，ICML，CVPR，ECCV，ICCV等国际著名大会上发表过的文章知晓，有强烈的获取知识的好奇心；6、较强的英文阅读理解能力，能熟读英文技术文档；7、具有较强的责任、良好的沟通能力以及团队合作精神；加分项在NIPS，ICML，CVPR，ECCV，ICCV上发表过文章；有机器健康诊断/预测项目经验；有医疗图像处理项目经验；,中国北京清华大学微电子学研究所,2018-03-18,北京,其它,100-499人,1-3年,硕士,10000-20000元/月
北京,机器学习,资深算法专家,,京东集团,面议,北京,招聘中,http://jobs.zhaopin.com/192921312309252.htm,1.结合智能供应链选品场景，应用AI、ML技术解决实际问题，如趋势预测，智能选品等；2.参与智能供应链大数据的机器学习、人工智能方向的技术方案架构与研发；3.参与图像处理、图像识别等相关算法的研究、设计、实现及优化；4.负责算法的工程化、产品化工作；5.关注计算机视觉、机器学习领域的最新研究进展，跟踪、调研前沿动态，完成开源代码及框架的部署。 ,  0.平均每段工作经历两年以上，硬性无特批（博士例外）1.计算机/数学/机器学习/深度学习/图像算法等相关领域硕士及以上学历；2.熟悉常用的机器学习/深度学习/图像处理算法和工具，包括但不限于CNN、RNN、OpenCV等，并有较强的动手实现能力；3.在模式识别、OCR、图像检索等计算机视觉领域有深厚的研究基础优先；4.有较强的英文文献阅读和理解能力。,北京,2018-03-18,北京,外商独资,20-99人,5-10年,硕士,
北京,机器学习,软件工程师,,北京理工大学智能机器人与系统高精尖创新中心,10001-15000,北京,招聘中,http://jobs.zhaopin.com/368457982250083.htm,神经影像图像分析用机器学习算法进行数据分析独立分析、整理及编写相关技术的文档,具备计算机，电子工程，数学，物理，统计学等相关专业毕业，具有较强的专业基本知识及素养有研究生学位，优先考虑有博士学位的候选人具有生物医学图像处理经验，能熟练运用部分以下软件的FSL，AFNI，FreeSurfer，SPM，ImageJ，3DSlicer具有机器学习经验，掌握机器学习算法，优先考虑掌握deeplearning的候选人数学基础好，有数学建模的经验有良好的编程能力，会使用R，Linux，掌握Linuxshellprogramming优先考虑有神经科学研究经验的候选人能够熟练的查找中外文献资料并具有良好的英文读、写能力耐压力强，有责任心，沟通能力良好，有良好的团队协作精神 ,北京中关村南大街5号北京理工大学,2018-03-18,北京,事业单位,500-999人,,本科,10001-15000元/月
北京,机器学习,Python讲师,,北京中公教育科技股份有限公司,10001-15000,北京,招聘中,http://jobs.zhaopin.com/217000521259320.htm,1、完成相关的教学资料（实训大纲、教学PPT、教学用书、教学案例等）的研发工作；2、按照教学规范和教学大纲高质量完成Python课程的授课任务；3、带领学员参加实训并指导学员完成实操项目；4、根据学生及市场需要，高质量完成公开课、讲座、网络直播课等授课任务；5、结合搜索引擎的发展变化，实时改进教学方法，完善教学体系；6、完成课程辅导工作，解答学员课程疑问，保证学员的学习质量；7、配合其它部门和集团完成相关工作。 二、 ,1、 热爱教育行业，计算机相关专业，大学本科及以上学历，两年或以上工作经验；2、 较好的心理素质，能够承受压力，具有较强的事业心与团队协作精神；3、 表达能力强，声音清晰自然，个性开朗，乐于与人交流；4、 熟练掌握大数据相关算法与数据结构；5、 精通Java语言开发经验，特别是数据库和多线程开发，熟悉常见的Java开发框架及开发能力；6、 熟练掌握Python编程语言与机器学习框架；7、 理解框架的设计思想及实现，具有良好的代码风格、接口设计与程序架构；8、 2年（含）以上对于Hadoop、Hive、Impala， Hbase、Spark、Sqoop有实际的编码能力和海量数据的自动化分析处理项目经验；9、  熟悉主流分布式处理框架，基于Hadoop的数据挖掘、大数据组件开发和封装；10、有一年以上教学经验者优先考虑。薪酬福利1、择优解决北京户口应届研究生在北京总部实习满半年以上，可择优解决北京户口；2、工作地点双向选择31家省级研究院遍布全国范围内，公司会充分尊重员工对工作地点选择的意愿；3、带薪培训试用期间带薪培训，提高专业技术能力；定期组织在职培训，不断提升专业素质；4、薪酬待遇年薪12－40万；基本薪资、课时工资、绩效奖金、年终奖金、工龄奖；5、基本福利社会保险、住房公积金、带薪假期(年假、婚假、产检假、产假）；6、补充福利员工餐厅、员工健身房、年度体检、年度旅游、阳光互助基金；7、长期激励计划股权激励。 ,北京市海淀区学清路23号汉华世纪大厦B座,2018-03-18,北京,民营,10000人以上,,本科,10001-15000元/月
北京,机器学习,培训生 & 实习生,,渣打环球商业服务有限公司,10001-15000,北京,招聘中,http://jobs.zhaopin.com/318418614250926.htm,,,天津经济技术开发区信环北街35号,2018-03-18,北京,外商独资,1000-9999人,,本科,10001-15000元/月
北京,机器学习,高级java开发工程师(002597),62%,车好多集团,20001-30000,北京,招聘中,http://jobs.zhaopin.com/345704188259616.htm,职位描述工作职责1、基于海量数据，支持业务对数据的分析和使用2、支持业务处理数据的流式处理、分析用户行为等3、通过海量数据，分析与挖掘各种潜在关联任职资格,职位要求  1、最好3年以上java开发工作经验，计算机相关专业本科及以上学历 2、有扎实的编程能力，有优秀的设计和代码品位，对解决具有挑战性问题充满激情3、精通Java开发语言，熟练运用各种常用算法和数据结构，有独立的实现能力4、熟悉常用的开源组件Hadoop/Hive/Spark/Storm，并了解其特性和使用场景优先5、熟悉机器学习、数据挖掘、数据分析、分布式计算至少某一方面，有较深的理论研究和实践经验优先6、优秀的沟通理解能力，能快速理解业务，用数据解读业务7、数据分析、推荐、机器学习、数据挖掘相关的开发工作优先,北京市海淀区八维学校五号楼（上地七街附近）,2018-03-18,北京,民营,10000人以上,3-5年,本科,20001-30000元/月
北京,机器学习,计量分析师（消费金融业务方向）,,京东金融,面议,北京,招聘中,http://jobs.zhaopin.com/192921312301784.htm,1、设计开发风险计量模型，并对模型的运行情况进行监测与评价，为授信政策、风险监测、产品开发、用户精细化管理等提供支持；2、基于互联网、电子商务海量数据，针对用户的购物和浏览特征，分析用户属性和行为特征，挖掘刻画用户画像；3、跟进落实模型成果落地与部署；4、跟踪、监控模型表现，根据监控结果对模型进行优化。,1、硕士以上学历，计算机、数学和统计学背景，熟悉常用的数据挖掘算法，熟悉各类数据分析方法，并具有一定的实践经验；2、扎实的理论和算法基础，能够在Spark环境下快速高效的实现常用机器学习模型和算法；3、具有较强的数据推理及分析能力、沟通协调能力，具有较强的执行力及创新能力；4、良好的学习意愿和学习能力，能够快速掌握工作所需技能，对海量数据在金融场景下的应用感兴趣。,北京市大兴区经海路亦庄京东总部A座,2018-03-18,北京,外商独资,1000-9999人,3-5年,本科,
北京,机器学习,信息管理部模型开发与管理室经理,,中国民生银行股份有限公司,面议,北京,招聘中,http://jobs.zhaopin.com/000067551251679.htm,1.负责带领和指导团队开发数据和制定模型驱动的技术方案，解决不同场景下的业务问题，包含但不限于风控、营销、客户生命周期管理、差异化定价等；2.负责带领团队进行模型的生命周期管理，并优化已上线模型；3.负责带领团队进行前沿算法研究和探索，实现自主创新；4.负责与业务部门紧密合作，通过数据分析和建模优化业务流程、解决业务的疑难点，并对业务工作提出建设性意见；5.负责定期开展团队技术和业务培训，科学有效管理团队。,1.年龄40岁（含）以下，金融、会计、审计、信息安全、计算机、经济管理等专业全日制本科及以上学历；2.具有6年及以上金融从业工作经验，3年及以上相关专业工作经验；3.对特别优秀者可适当放宽学历、工作年限要求；4.具有5年以上从事统计分析/建模/数据挖掘/机器学习等工作经验，其中包含3年以上在金融领域中与数据科学相关的工作经验，有丰富的风险类模型和营销类模型项目开发经验；5.具有扎实的技术基础，精通主流数据处理、分析及算法开发工具(SQL/SAS/PYTHON/R等），具有大数据平台上项目开发经验者优先。,北京,2018-03-18,北京,民营,10000人以上,5-10年,本科,
